{
 "schema": "guide/1",
 "id": "prologue.sprocket_row.first_session_guide",
 "revision": 1,
 "steps": [
  {
   "id": "boiler",
   "speaker": "A fixture professor",
   "line": "A fixture card says where to press.",
   "button": "Fixture button"
  },
  {
   "id": "queue_spanners",
   "speaker": "A fixture professor",
   "line": "A fixture card says where to press."
  },
  {
   "id": "first_spanner",
   "speaker": "A fixture professor",
   "line": "A fixture card says where to press."
  },
  {
   "id": "pips_bill",
   "speaker": "A fixture professor",
   "line": "A fixture card says where to press."
  },
  {
   "id": "equip",
   "speaker": "A fixture professor",
   "line": "A fixture card says where to press."
  },
  {
   "id": "rats",
   "speaker": "A fixture professor",
   "line": "A fixture card says where to press."
  },
  {
   "id": "pay_bill",
   "speaker": "A fixture professor",
   "line": "A fixture card says where to press."
  },
  {
   "id": "brass_plate",
   "speaker": "A fixture professor",
   "line": "A fixture card says where to press."
  },
  {
   "id": "come_back",
   "speaker": "A fixture professor",
   "line": "A fixture card says where to press.",
   "button": "Fixture button"
  }
 ]
}
